{
  "shot_id": "shot_f434c6",
  "duration_s": 4,
  "camera_motion": [
    "slow_pan"
  ],
  "subject_motion": [
    "blink"
  ],
  "background_motion": [
    "parallax"
  ],
  "hard_constraints": [
    "No character identity drift",
    "No new objects",
    "No wardrobe changes",
    "No scene relighting"
  ]
}