{
  "shot_id": "shot_03be7e",
  "duration_s": 5,
  "camera_motion": [
    "slow_orbit"
  ],
  "subject_motion": [
    "blink"
  ],
  "background_motion": [
    "parallax",
    "particles"
  ],
  "hard_constraints": [
    "No character identity drift",
    "No new objects",
    "No wardrobe changes",
    "No scene relighting"
  ]
}