{
  "shot_id": "shot_7dfb54",
  "duration_s": 8,
  "camera_motion": [
    "slow_dolly"
  ],
  "subject_motion": [
    "blink"
  ],
  "background_motion": [
    "parallax",
    "wind",
    "water",
    "particles"
  ],
  "hard_constraints": [
    "No character identity drift",
    "No new objects",
    "No wardrobe changes",
    "No scene relighting"
  ]
}