{
  "shot_id": "shot_539e3b",
  "duration_s": 4,
  "camera_motion": [
    "slow_dolly"
  ],
  "subject_motion": [
    "head_turn"
  ],
  "background_motion": [
    "parallax"
  ],
  "hard_constraints": [
    "No character identity drift",
    "No new objects",
    "No wardrobe changes",
    "No scene relighting"
  ]
}